{
  "analysis_id": "synthetic-observational-corner-speed-association",
  "classification": "confirmatory",
  "comparisons": [
    {
      "comparison_id": "corner-minimum-speed",
      "directionality": "increase_is_improvement",
      "effect_size": "median_paired_difference",
      "method": "paired_difference",
      "metric_id": "segment-minimum-speed",
      "practical_threshold": {
        "magnitude": 0.3,
        "rationale": "A fabricated smallest difference worth noticing, fixed before any value was inspected so that a statistically distinguishable but trivial difference cannot be presented as meaningful.",
        "source": "frozen_protocol",
        "unit": "m/s"
      },
      "role": "primary",
      "subset": null
    },
    {
      "comparison_id": "corner-speed-consistency",
      "directionality": "two_sided_no_preferred_direction",
      "effect_size": "dispersion_ratio",
      "method": "consistency",
      "metric_id": "segment-minimum-speed",
      "practical_threshold": {
        "magnitude": 0.2,
        "rationale": "A fabricated smallest change in dispersion worth noticing. Lower dispersion is reported, never asserted to be better.",
        "source": "frozen_protocol",
        "unit": "ratio"
      },
      "role": "secondary",
      "subset": null
    }
  ],
  "evidence_scope": "primary",
  "evidence_set": {
    "definition_sha256": "05ec3c2f7406237940643319038f5bb884607733ced22fc8bec6988b5c4e19ca",
    "evidence_set_id": "synthetic-observational-corner-speed",
    "version": "1.0.0"
  },
  "experimental_unit": "lap",
  "falsification_tests": [
    {
      "description": "Recompute the estimate without each pair in turn and report whether the direction ever changes.",
      "kind": "leave_one_unit_out",
      "test_id": "leave-one-pair-out"
    },
    {
      "description": "Recompute the estimate without each block in turn; a direction carried by one block is fragile.",
      "kind": "leave_one_cluster_out",
      "test_id": "leave-one-block-out"
    },
    {
      "description": "Remove the single pair furthest from the median difference and report whether the direction and practical magnitude survive.",
      "kind": "outlier_dependence",
      "test_id": "outlier-dependence"
    },
    {
      "description": "Split the ordered pairs in half and report whether both halves carry the direction.",
      "kind": "order_effect_early_versus_late",
      "test_id": "early-versus-late"
    },
    {
      "description": "Estimate within each block separately and report whether the direction is isolated to one of them.",
      "kind": "isolation_by_cluster",
      "test_id": "isolation-by-block"
    }
  ],
  "family": {
    "alpha": 0.05,
    "correction": "holm_bonferroni",
    "family_id": "observational-corner-speed",
    "members": [
      "corner-minimum-speed",
      "corner-speed-consistency"
    ],
    "role": "confirmatory_primary"
  },
  "grouping": {
    "kind": "paired",
    "unpaired_justification": null
  },
  "hypothesis": "The later observed block is associated with a different segment minimum speed.",
  "interpretation_ceiling": "associational",
  "limitations": [
    "Nothing was delivered to the driver. Any difference between these blocks is an association with block order and everything that changed alongside it, never an effect of coaching.",
    "Every value analysed here is fabricated; no racing conclusion follows from any number in this run.",
    "A statistical result is not a finding, and a finding is not a product change."
  ],
  "missing_data_policy": "exclude_unit_and_report",
  "null_hypothesis": "The later observed block is associated with no difference in segment minimum speed.",
  "outlier_policy": "retain_all_and_report_sensitivity",
  "primary_metric": {
    "metric_id": "segment-minimum-speed",
    "sha256": "8987ddbdfe09906981d9950bf44d80a41f9ed15d4a631a0345bf5d6324d56291",
    "version": "1.0.0"
  },
  "protocol": {
    "experiment_id": "synthetic-inference-observational",
    "experiment_version": "1.0.0",
    "freeze_id": "synthetic-inference-observational.freeze",
    "freeze_sha256": "5e443f6b356e8923c5905e51ae44abaff5daea174709f39692d94ef10230355d"
  },
  "replication_policy": {
    "holdout_inspected": false,
    "required_scope": "different_session",
    "state": "required_before_validation"
  },
  "resampling_unit": "block",
  "schema_version": "apex-labs.inferential-analysis-definition/v1",
  "scientific_question": "Is the later observed fabricated block associated with a different segment minimum speed than the earlier one?",
  "secondary_metrics": [],
  "sufficiency_rule": {
    "minimum_experimental_units": 8,
    "minimum_pairs": 4,
    "minimum_participants": 1,
    "minimum_resampling_clusters": 2,
    "pilot_reference": null,
    "source": "frozen_protocol",
    "source_declarations": [
      "At least 4 comparable within-driver pairs and at least 2 blocks for a mechanics-level contrast"
    ],
    "stopping_rule": "Analysis runs once over the complete preregistered block set. There is no interim look and no rule permitting collection to continue until the result becomes attractive."
  },
  "synthetic": true,
  "title": "Observational association between two fabricated blocks",
  "uncertainty": {
    "bootstrap_draws": 2000,
    "coverage_level": 0.95,
    "interval_semantics": "Percentile interval over a deterministic cluster bootstrap that resamples whole blocks. It describes sampling variability of this estimator on this evidence and is not a probability statement about the true effect.",
    "method": "deterministic_cluster_percentile_bootstrap",
    "minimum_resampling_clusters": 2,
    "random_seed": 20260820,
    "resampling_unit": "block"
  },
  "version": "1.0.0"
}
