{
  "analysis_id": "synthetic-unpaired-delivered-cue-contrast",
  "classification": "confirmatory",
  "comparisons": [
    {
      "comparison_id": "delivered-cue-minimum-speed",
      "directionality": "increase_is_improvement",
      "effect_size": "median_difference",
      "method": "unpaired_difference",
      "metric_id": "segment-minimum-speed",
      "practical_threshold": {
        "magnitude": 0.3,
        "rationale": "The same fabricated smallest difference worth noticing as the paired contrast.",
        "source": "frozen_protocol",
        "unit": "m/s"
      },
      "role": "primary",
      "subset": null
    },
    {
      "comparison_id": "corner-speed-consistency",
      "directionality": "two_sided_no_preferred_direction",
      "effect_size": "dispersion_ratio",
      "method": "consistency",
      "metric_id": "segment-minimum-speed",
      "practical_threshold": {
        "magnitude": 0.2,
        "rationale": "A fabricated smallest change in dispersion worth noticing. Lower dispersion is reported, never asserted to be better.",
        "source": "frozen_protocol",
        "unit": "ratio"
      },
      "role": "secondary",
      "subset": null
    }
  ],
  "evidence_scope": "primary",
  "evidence_set": {
    "definition_sha256": "32b82931a4d31b1d2c29323333fb33a9b6698c229d0f3c568e7efa4fbea990e8",
    "evidence_set_id": "synthetic-unpaired-delivered-cue",
    "version": "1.0.0"
  },
  "experimental_unit": "lap",
  "falsification_tests": [
    {
      "description": "Recompute the estimate without each pair in turn and report whether the direction ever changes.",
      "kind": "leave_one_unit_out",
      "test_id": "leave-one-pair-out"
    },
    {
      "description": "Recompute the estimate without each block in turn; a direction carried by one block is fragile.",
      "kind": "leave_one_cluster_out",
      "test_id": "leave-one-block-out"
    },
    {
      "description": "Remove the single pair furthest from the median difference and report whether the direction and practical magnitude survive.",
      "kind": "outlier_dependence",
      "test_id": "outlier-dependence"
    },
    {
      "description": "Split the ordered pairs in half and report whether both halves carry the direction.",
      "kind": "order_effect_early_versus_late",
      "test_id": "early-versus-late"
    },
    {
      "description": "Estimate within each block separately and report whether the direction is isolated to one of them.",
      "kind": "isolation_by_cluster",
      "test_id": "isolation-by-block"
    }
  ],
  "family": {
    "alpha": 0.05,
    "correction": "holm_bonferroni",
    "family_id": "delivered-cue-contrast",
    "members": [
      "delivered-cue-minimum-speed",
      "corner-speed-consistency"
    ],
    "role": "confirmatory_primary"
  },
  "grouping": {
    "kind": "unpaired",
    "unpaired_justification": "Cue delivery was recorded after the fact rather than assigned, so no baseline unit corresponds to a specific intervention unit."
  },
  "hypothesis": "Delivered-cue laps differ in segment minimum speed from undelivered-cue laps.",
  "interpretation_ceiling": "intervention_associated",
  "limitations": [
    "Whether the cue was delivered was not assigned. Anything that made delivery more likely is an uncontrolled alternative explanation for any difference reported here.",
    "Every value analysed here is fabricated; no racing conclusion follows from any number in this run.",
    "A statistical result is not a finding, and a finding is not a product change."
  ],
  "missing_data_policy": "exclude_unit_and_report",
  "null_hypothesis": "Delivered-cue laps do not differ in segment minimum speed from undelivered-cue laps.",
  "outlier_policy": "retain_all_and_report_sensitivity",
  "primary_metric": {
    "metric_id": "segment-minimum-speed",
    "sha256": "8987ddbdfe09906981d9950bf44d80a41f9ed15d4a631a0345bf5d6324d56291",
    "version": "1.0.0"
  },
  "protocol": {
    "experiment_id": "synthetic-inference-controlled",
    "experiment_version": "1.0.0",
    "freeze_id": "synthetic-inference-controlled.freeze",
    "freeze_sha256": "35189ae5964fcd1fb7e59fd834bb81c0ced572b661e90b0291895a10d81f6486"
  },
  "replication_policy": {
    "holdout_inspected": false,
    "required_scope": "different_session",
    "state": "required_before_validation"
  },
  "resampling_unit": "block",
  "schema_version": "apex-labs.inferential-analysis-definition/v1",
  "scientific_question": "Do laps in fabricated blocks where the cue was delivered differ in segment minimum speed from laps where it was not?",
  "secondary_metrics": [],
  "sufficiency_rule": {
    "minimum_experimental_units": 8,
    "minimum_pairs": null,
    "minimum_participants": 1,
    "minimum_resampling_clusters": 2,
    "pilot_reference": null,
    "source": "frozen_protocol",
    "source_declarations": [
      "At least 4 comparable within-driver pairs and at least 2 blocks for a mechanics-level contrast"
    ],
    "stopping_rule": "Analysis runs once over the complete preregistered block set. No pair requirement applies because the design is explicitly unpaired."
  },
  "synthetic": true,
  "title": "Unpaired contrast between fabricated delivered and undelivered cue blocks",
  "uncertainty": {
    "bootstrap_draws": 2000,
    "coverage_level": 0.95,
    "interval_semantics": "Percentile interval over a deterministic cluster bootstrap that resamples whole blocks. It describes sampling variability of this estimator on this evidence and is not a probability statement about the true effect.",
    "method": "deterministic_cluster_percentile_bootstrap",
    "minimum_resampling_clusters": 2,
    "random_seed": 20260820,
    "resampling_unit": "block"
  },
  "version": "1.0.0"
}
